	id_sent	n_sent	id_article	sent
832	832	8.0	30	when it comes to penalties - after Gianluigi Donnarumma, Italy's imposing goalkeeper, dived to his left and saved the decisive spot kick by 19-year-old Londoner Bukayo Saka, one of the youngest players in England's squad.
833	833	9.0	30	That was England's third straight failure from the penalty spot in the shootout, with Marcus Rashford and Jadon Sancho - players brought on late in extra time seemingly as specialist penalty-takers - also missing.
834	834	10.0	30	As Saka and Sancho cried, Donnarumma was mobbed by his teammates as they sprinted toward him from the halfway line at the end of the second penalty shootout in a European Championship final.
835	835	11.0	30	Then Italy's jubilant players headed to the other end of the field and ran as one, diving to the ground in front of the Italian fans who have witnessed a rebirth of their national team.
836	836	12.0	30	It was less than four years ago that Italy plunged to the lowest moment of its soccer history by failing to qualify for the World Cup for the first time in six decades.
837	837	13.0	30	Now, they are the best team in Europe and on a national-record 34-match unbeaten run under Roberto Mancini, their suave coach who has won an international trophy in his first attempt to add to the country's other European title - in 1968 - and its four World Cups.
838	838	14.0	30	Mancini joined his players on the podium as Italy captain Giorgio Chiellini lifted the Henri Delaunay trophy to the backdrop of fireworks and tickertape.
839	839	15.0	30	It was impossible even to just consider this at one stage, Mancini said, but the guys were just amazing.
840	840	16.0	30	I have no words for them. For England, it's the latest heartache in shootouts at major tournaments, after defeats in 1990, 1996, 1998, 2004, 2006 and 2012.
841	841	17.0	30	They ended that losing streak by beating Colombia on penalties in the round of 16 at the 2018 World Cup, but the pain has quickly returned.
842	842	18.0	30	The boys couldn't have given more, England captain Harry Kane said.
843	843	19.0	30	Penalties are the worst feeling in the world when you lose.
844	844	20.0	30	It's been a fantastic tournament - we should be proud, hold our heads up high.
845	845	21.0	30	It's going to hurt now, it's going to hurt for a while. EURO 2020 FINAL:
846	846	22.0	30	Fans without tickets storm into Wembley Stadium SPORTS NEWSLETTER: Sign up now to get top sports headlines delivered daily England's first major final in 55 years had all started so well, too, with Luke Shaw scoring the fastest goal in a European Championship final by meeting a cross from opposite wing back
847	847	23.0	30	Kieran Trippier with a half-volley that went in off the post in the second minute.
848	848	24.0	30	It was Shaw's first goal for England and it prompted a fist-pump between David Beckham and Tom Cruise in the VIP box amid an explosion of joy around Wembley, which had at least 67,000 fans inside.
849	849	25.0	30	Maybe more, given dozens of ticketless England fans managed to barge their way past stewards and police and into the stadium in unsettling scenes before kickoff.
850	850	26.0	30	That was the only time Italy's famously robust defense was really opened up in the entire 120 minutes.
851	851	27.0	30	Indeed, after Shaw's goal, England barely saw the ball for the rest of the game.
852	852	28.0	30	Italy's midfielders dominated possession, as widely predicted before the match, and England simply resorted to dropping deep and getting nine or even all 10 outfield players behind the ball.
853	853	29.0	30	It was reminiscent of the 2018 World Cup semifinals, when England also scored early against Croatia then spent most of the game chasing its opponent's midfield before losing in extra time.
854	854	30.0	30	Italy's equalizer was merited and Bonucci was the unlikely scorer.
855	855	31.0	30	He put the ball in from close range after a right-wing corner was flicked on to Marco Verratti, whose stooping header was tipped onto the post by goalkeeper Jordan Pickford.
856	856	32.0	30	England managed to hold on for extra time - the way three of the last six European finals went - and actually had the better of the final stages.
857	857	33.0	30	After the misses of Rashford - he stuttered up to the ball and then hit the post - and Sancho, whose shot was saved by Donnarumma again down to his left, Jorginho had the chance to win it for Italy.
858	858	34.0	30	Incredibly, the midfielder who converted the decisive penalty in a shootout win over Spain in the semifinals also failed to score as Pickford tipped the effort off the post.
859	859	35.0	30	It was Donnarumma who then made the crucial saves and within minutes he had also been named player of the tournament, the first goalkeeper to be so honored.
860	860	36.0	30	So instead of coming home, the trophy is headed to Rome.
861	861	37.0	30	We'd heard it day in, day out from Wednesday night - we heard it would be coming home to London, Bonucci said.
862	862	38.0	30	I'm sorry for them, but the cup will be taking a nice flight, making its way to Rome
863	863	1.0	31	England's bid to end their 55-year wait for a major trophy ended in the familiar agony of defeat in a penalty shootout as Italy claimed the Euro 2020 crown at Wembley.
864	864	2.0	31	On a night of anticipation, tension and ultimate heartbreak in a feverish atmosphere, England looked on course for their most joyous day since 30 July 1966 when Luke Shaw gave them the perfect start after two minutes.
865	865	3.0	31	Italy, unbeaten in 33 matches before this final, slowly edged their way back into the game and were level in the 67th minute when Leonardo Bonucci pounced after England goalkeeper Jordan Pickford turned Marco Verratti's header on to a post.
866	866	4.0	31	And after a tense period of extra time failed to find a winner
867	867	5.0	31	, it was on to penalties and bitter disappointment for England manager Gareth Southgate and his players, who had gone into this final on a wave of expectation and high emotion.
868	868	6.0	31	England missed three of their five penalties, Marcus Rashford hitting a post and Gianluigi Donnarumma denying Jadon Sancho before - so cruelly for such a fine young player - Arsenal teenager Bukayo Saka also saw the giant Italy goalkeeper save his spot-kick.
869	869	7.0	31	Harry Kane and Harry Maguire scored for England but, while Pickford kept hopes alive with saves from Andrea Belotti and Jorginho, Domenico Berardi, Bonucci and Federico Bernardeschi scored for Italy.
870	870	8.0	31	The tearful 19-year-old Saka, who showed such courage to step forward, was consoled by his team-mates and manager, but there was no real consolation for them or the expectant fans packed into Wembley.
871	871	9.0	31	England's years of hurt go on but it looked for the first 30 minutes of this final that the moment the country has waited more than 20,000 days for had finally arrived.
872	872	10.0	31	Southgate's side came firing out of the blocks and the manager's one change - replacing Saka with Kieran Trippier - paid an instant dividend as Trippier ran on to Kane's perfect pass to find the onrushing Shaw at the far post
873	873	11.0	31	England were up and running and urged on by a vast, frenzied crowd they had this talented, streetwise Italian side on the back foot until they suddenly gained a foothold in the closing phase of the first half.
874	874	12.0	31	Italy dominated possession, and it was no surprise when they restored parity, then looking the more likely winners as Southgate's side, so full of running early on, started to labour, particularly after losing the outstanding Declan Rice to a knock.
875	875	13.0	31	Southgate surprisingly waited until extra time to introduce Jack Grealish but by that stage the game was locked on course for penalties
876	876	14.0	31	Sancho and Rashford came on in the closing moments, presumably in readiness for penalties, but sadly for Southgate, who has got so much right in Euro 2020, this was one move that did not pay off as both failed with their spot-kicks.
877	877	15.0	31	Pickford performed heroics to save two penalties but he was also left in tears after England's fate was sealed.
878	878	16.0	31	Italy edged over the line and both Southgate and his players looked devastated as they took sympathetic applause from England's fans, who had arrived with such high hopes but filed out of Wembley with their dreams of a major trophy shattered once more.
879	879	17.0	31	England came close when they reached the semi-final of the World Cup in Moscow in 2018 but this loss will cut even deeper after they made such smooth progress to the final and had the chance to finally claim a second trophy in what was effectively a home tournament with its climax at Wembley.
880	880	18.0	31	They have made progress - but still England could not clear the final hurdle.
881	881	19.0	31	Improving England offer real hope Southgate has led England to a World Cup semi-final and now a European Championship final in the last two tournaments England's loss will be felt deeply after such impressive progress through the knockout stage with wins against Germany, Ukraine and Denmark.
882	882	20.0	31	Southgate must now digest whether he got it right in the final when it came to his approach, substitutions and penalty-takers but when the dust settles England can reflect on progress made.
883	883	21.0	31	England took one step further than they did in Russia and Southgate now has a potent blend of youth and experience to work with as he plots a course to the 2022 World Cup in Qatar.
884	884	22.0	31	Saka came of age in this tournament while England have exciting young in the shape of Sancho, Phil Foden, Mason Mount and Jude Bellingham, augmented by Grealish.
885	885	23.0	31	Raheem Sterling had had a stellar campaign, Kane showed flashes of his world-class ability and the central defensive pair of John Stones and Maguire were solid.
886	886	24.0	31	This will offer no comfort in the hours following such a devastating loss, but England can at least move forward with optimism.
887	887	25.0	31	Italy worthy winners Italy have won their sixth major tournament title (four World Cup, two Euros); among European nations, only Germany (seven) have won more As Italy's players and staff celebrated in front of their exultant fans, manager Roberto Mancini was left to reflect on an outstanding job, their 34th game unbeaten crowned with the Euro 2020 title.
888	888	26.0	31	Mancini has put together an impressive mix of youth and experience, and at the back he can still rely on those two old warhorses of Juventus and Italy, Bonucci and Giorgio Chiellini, as durable as ever despite a combined age of 70.
889	889	27.0	31	Italy proved their pedigree with wins over Belgium and Spain in the knockout stage and were unfazed by having to face a thunderous Wembley packed with England fans.
890	890	28.0	31	And all done after failing to qualify for the 2018 World Cup in Russia, which was regarded as a national sporting humiliation.
891	891	29.0	31	Now Italy are back as the winners of Euro 2020, testimony to the work of Mancini and his players.
892	892	30.0	31	the stats Italy have won their second European Championship title, and first in 53 years (also 1968); it's the longest ever gap between championships in the tournament by a single nation, surpassing Spain's 44-year wait from 1964 to 2008.
893	893	31.0	31	England have won just 22% (two of nine) of their major tournament shootouts (World Cup/Euros), the lowest ratio of any European nation to have been involved in three or more.
894	894	32.0	31	Italy found themselves trailing in a game for the first time at Euro 2020, while overall they spent 65 minutes behind against England in the final, 21 more than they had been behind in their 33-game unbeaten run (in all competitions) coming into the final (44).
895	895	33.0	31	England posted their lowest possession in a game at Wembley (34.4%) since November 2016 v Spain (34.3%).
896	896	34.0	31	Gareth Southgate has made at least one change to the England starting XI for 37 consecutive matches, making a total of 200 changes in that time and last staying with the same starting line-up in the 2018 World Cup semi-final.
897	897	35.0	31	At one minute 57 seconds, Luke Shaw's opener (his first ever goal for England) was the quickest goal scored in the final of the European Championship, while it was also England's quickest in the competition overall and the earliest Italy have ever conceded in the competition.
898	898	36.0	31	At 34 years and 71 days, Italy's Leonardo Bonucci became the oldest player ever to score in a European Championship final, and second-oldest for a European side in any major tournament final (World Cup/Euros), after Nils Liedholm for Sweden v Brazil at the 1958 World Cup (35 years, 264 days).
899	899	37.0	31	Against Italy, Harry Kane failed to muster a shot or create a goal-scoring chance for only the second time in his 61 appearances for England, also doing so in a friendly against Switzerland in September 2018.
900	900	38.0	31	Player of the match Shaw Luke Shaw with an average of 7.66 Italy Italy Italy England England England Italy Avg Squad number 14 Player name Chiesa Average rating
901	901	39.0	31	7.20 Squad number 21 Player name G Donnarumma Average rating 6.86 Squad number 19 Player name Bonucci Average rating
902	902	40.0	31	6.25 Squad number 8 Player name Jorginho Average rating 6.10 Squad number 13 Player name Emerson Average rating 6.01 Squad number 5 Player name Locatelli Average rating
903	903	41.0	31	5.87 Squad number 2 Player name Di Lorenzo Average rating
904	904	42.0	31	5.80 Squad number 24 Player name Florenzi Average rating 5.77 Squad number 18 Player name Barella Average rating 5.77 Squad number 11 Player name Berardi Average rating 5.74 Squad number 16 Player name Cristante Average rating
905	905	43.0	31	5.64 Squad number 17 Player name Immobile Average rating 5.44 England Avg Squad number 3 Player name Shaw Average rating
906	906	44.0	31	7.24 Squad number 1 Player name Pickford Average rating 7.17
907	907	45.0	31	6.71 Squad number 6 Player name Maguire Average rating 6.60 Squad number 12 Player name Trippier Average rating
908	908	46.0	31	Player name Stones Average rating 6.52 Squad number 7 Player name
909	909	47.0	31	4.42 Squad number 11 Player name Rashford Average rating 3.31 Squad number 17 Player name Sancho Average rating 3.30
910	910	1.0	32	Italy won the European Championship for the first time since 1968 as goalkeeper Gianluigi Donnarumma saved two England penalties en route to a 3-2 shoot-out win.
911	911	2.0	32	Both sides had fought out a 1-1 extra-time draw at a raucous Wembley on Sunday.
912	912	3.0	32	The giant keeper saved from Jadon Sancho and Bukayo Saka after Marcus Rashford hit the post, as Federico Bernardeschi, Leonardo Bonucci and Domenico Berardi all scored for the Italians.
913	913	4.0	32	Luke Shaw had given England a dream start with a superb goal after two minutes
914	914	5.0	32	but Italy, who offered almost nothing in response in the first half, gradually took command as the hosts sat back and leveled through Bonucci after 67 minutes.
915	915	6.0	32	It was the first final to be decided on penalties since Czechoslovakia beat West Germany in 1976 and will be wildly celebrated in Italy after they lost in the final in 2000 and 2012.
916	916	7.0	32	They made most of the running after halftime and in extra time and England can have few complaints after their early promise faded away.
917	917	8.0	32	It was nevertheless heartbreaking for most of the 67,000 Wembley crowd as England came up short in their first major final since they won the World Cup 55 years ago.
918	918	9.0	32	It had all started so well when Harry Kane spread the ball wide to Kieran Trippier
919	919	10.0	32	Gareth Southgate-™s faith in recalling him by sending over a curling deep cross that the fast-arriving Shaw met on the half volley to hammer inside the post for his first international goal.
920	920	11.0	32	™s Luke Shaw celebrates scoring their first goal [Frank Augstein/Reuters]
921	921	12.0	32	England had taken an early lead in their 2018 World Cup semi-final against Croatia before eventually being outplayed and beaten in extra time, but they did not look like giving up the initiative on home soil, playing on the front foot, though failing to threaten Donnarumma.
922	922	13.0	32	England keeper Jordan Pickford was similarly untroubled as Federico Chiesa-
923	923	14.0	32	™s blocked effort were all Italy had to show for a disjointed half.
924	924	15.0	32	Pickford was called into action after 57 minutes, blocking a Lorenzo Insigne shot and then getting down to palm away from Chiesa as Italy began to apply pressure, pinning England back.
925	925	16.0	32	It paid dividends when Bonucci pounced from close range after Pickford had turned Andrea Belotti-
926	926	17.0	32	It was a similar story in the first additional 15 minutes, though England did briefly force their way back into the game in the second period, albeit without either side creating anything to reward the crowd for their waves of noise.
927	927	18.0	32	So it went to penalties, where England-™s young guns failed and Italy took the glory.
928	928	1.0	33	Italy's prime minister announced Monday evening that he was expanding restrictions on travel to cover the entire country in an unprecedented peacetime move to try to stop the spread of coronavirus.
929	929	2.0	33	Giuseppe Conte said that a new government decree will require all Italians to meet a limited set of criteria -- such as a need to work or health conditions -- in order to travel outside the areas where they live.
930	930	3.0	33	He said the quarantine ordered by Rome in the north over the weekend was not enough and would have to be extended to the whole country, impacting the country's 60 million residents.
931	931	4.0	33	"There won't be just a red zone,"" Conte told reporters."
932	932	5.0	33	Italy registered 1,807 more confirmed cases as of Monday evening, for a national total of 9,172, the most cases of the virus outside of China.
933	933	6.0	33	The number of dead in Italy also increased by 97 to 463.
934	934	7.0	33	Early Sunday, Conte signed a decree attempting to lock down 16 million people in Italy's prosperous north -- including the entire Lombardy region and 14 provinces in the Piemonte, Veneto and Emilia Romagna regions -- until April 3.
935	935	8.0	33	Schools in Italy's center and south that were closed because of the virus were originally slated to re-open March 16.
936	936	9.0	33	Conte also criticized young people who have continued to gather to drink and have a good time amid a public health crisis.
937	937	10.0	33	Under the previous decree, pubs, bars and restaurants in the affected area were ordered to close at dusk.
938	938	11.0	33	"This nightlife ... we can't allow this anymore,"" he said."
939	939	12.0	33	The measures have caused confusion among Italians about who could travel where.
940	940	13.0	33	Authorities said Monday that six inmates in an Italian lockup died after they broke into the infirmary and overdosed on methadone.
941	941	14.0	33	The inmates were protesting virus containment measures inside the prison.
942	942	15.0	33	Authorities said inmates climbed onto the roof of the San Vittore prison in Milan and held up a painted sheet reading “Indulto,” Italian for pardon.
943	943	16.0	33	Measures to contain the spread of the virus have effectively ground the court system to a halt, increasing tensions among prisoners.
944	944	17.0	33	Italian doctors celebrated one small victory after the first patient diagnosed with the illness, a 38-year-old Unilever worker, was moved out of intensive care and began breathing on his own.
945	945	18.0	33	But the virus' rapid spread was forcing them to operate like war-time medics, triaging patients to decide who would receive access to scarce ICU beds.
946	946	19.0	33	Unfortunately we’re only at the beginning,” said Dr. Massimo Galli, head of infectious disease at Milan’s Sacco hospital.
947	947	20.0	33	"Travelers at Milan’s main train station had to sign police forms self-certifying that they are traveling for ""proven work needs,’’ situations of necessity, health reasons or to return home."
948	948	21.0	33	They also needed to provide identity documents, contact numbers and an exact reason for travel from the financial hub.
949	949	22.0	33	Across Italy, museums and archaeological sites were closed, weddings were canceled and restaurants were told to keep patrons more than 3 feet apart.
950	950	23.0	33	Officials ordered ski lifts across the country to close, even those outside the quarantine zone, after students whose classes were canceled began organizing trips to winter resorts.
951	951	24.0	33	Pope Francis celebrated Mass alone at the Vatican hotel where he lives, live-streaming the event, but he did resume some meetings.
952	952	25.0	33	For most people, the new coronavirus causes only mild or moderate symptoms, such as fever and cough.
953	953	26.0	33	For some, especially older adults and people with existing health problems, it can cause more severe illness, including pneumonia.
954	954	1.0	34	Italian Prime Minister Giuseppe Conte says travel restrictions and other strict public health measures will be imposed nationwide starting Tuesday to try to stop the spread of the new coronavirus.
955	955	2.0	34	Conte said Monday night that a new government decree will require people throughout the country of 60 million to demonstrate a need to work, health conditions or other limited reasons to travel outside the areas where they live.
956	956	3.0	34	The restrictions will take effect Tuesday and, as in northern Italy, will last until April 3, he said.
957	957	4.0	34	Conte told reporters, referring to the quarantine order he signed over the weekend that applied to a vast swath of northern Italy, with a population of 16 million.
958	958	5.0	34	Schools in the center and south of Italy that were closed because of the virus had been slated to reopen on March 16.
959	959	6.0	34	Italy registered 1,807 more confirmed cases as of Monday evening, for a national total of 9,172.
960	960	7.0	34	With those numbers, Italy again overtook South Korea as the country with the most cases outside China.
961	961	8.0	34	The number of people with the virus who died increased to 463.
962	962	9.0	34	The premier also took to task the young people in much of Italy who have been gathering at night to drink and have a good time during the public health emergency that started on Feb. 21.
963	963	10.0	34	This nightlife ... we can’t allow this anymore,” Conte said.
964	964	11.0	34	Under the weekend decree that applied to regions in the north, pubs, restaurants and cafes are required to close at dusk.
965	965	12.0	34	On Saturday night, alarmed at rumors over a quarantine in the north, many Italians fled the targeted regions in the northern red zone.
966	966	1.0	35	Payments on mortgages are to be suspended in Italy due to the coronavirus outbreak, the country’s government has announced.
967	967	2.0	35	More than 9,000 people have been infected by Covid-19 in Italy, where the total number of reported deaths jumped to 463 on Monday –
968	968	3.0	35	When asked about the possibility of halting mortgage payments on Radio Anch’io, Laura Castelli, the deputy economy minister, said: ”Yes, that will be the case, for individuals and households.
969	969	4.0	35	The entire country was placed on lockdown on Tuesday morning, with all public gatherings cancelled, and universities and schools closed until next month.
970	970	5.0	35	Giuseppe Conte, the prime minister, said that everyone in Italy would be confined to the area where they live unless they are able to demonstrate a need to work, health conditions, or other limited reasons in order to travel elsewhere.
971	971	6.0	35	The lockdown already in place for northern parts of the country, encompassing about 16 million people, has now been extended to the whole nation.
972	972	7.0	35	Bars, restaurants and cafes across Italy are also to close at dusk as the government works to limit the spread of
973	973	8.0	35	Chaos broke out at prisons nationwide on Monday as inmates protested anti-coronavirus measures, which included restrictions on normal family visits.
974	974	9.0	35	Multiple prisoners died of what could be drug-related causes after people raided the pharmacy in Modena jail during the riot, officials said.
975	975	10.0	35	Italy has been the worst-hit country in Europe by coronavirus, which originated in the Chinese city of Wuhan.
976	976	11.0	35	British Airways said on Tuesday that it had stopped all flights to the country after the lockdown measures were announced.
977	977	12.0	35	As of Tuesday, 52 per cent of deaths linked to Covid-19 outside China have happened in the southern European country.
978	978	13.0	35	More than 114,000 people have been infected with coronavirus – a flu-like disease that can develop into pneumonia – across the globe, with about 4,000 reported deaths.
979	979	1.0	36	Italian Prime Minister Giuseppe Conte signed a decree early Sunday, placing travel restrictions on the entire Lombardy region and 14 other provinces.
980	980	2.0	36	Locations affected by the lockdown include the financial hub Milan and the tourist destination of Venice and are subject to strict measures, including the closure of schools and universities and the cancellations of all public events, sports events and civil and religious ceremonies.
981	981	3.0	36	A woman walks in the almost deserted Central Station in Milan on Sunday after the lockdown was imposed overnight.
982	982	4.0	36	But questions remain as to how it will be enforced as trains and planes continued to go to and from Milan as scheduled on Sunday.
983	983	5.0	36	"There will be an obligation to avoid any movement of people,"" Conte said Sunday as he announced the new measures."
