	id_sent	n_sent	id_article	sent
675	675	5.0	26	The Tianwen-1 Mars orbiter will relay its signal to the rover during its mission and then conduct a global survey of the planet for one Martian year.
676	676	6.0	26	The probe has spent three months in orbit reconnoitering the landing area before releasing the rover to the surface.
677	677	7.0	26	Tianwen-1 was launched by a Long March 5 rocket from the Wenchang space launch center in Hainan on July 23 last year, and spent seven months en route to Mars before entered its orbit in February.
678	678	1.0	27	England's painful half-century wait for a major title goes on.
679	679	2.0	27	And it just had to be because of a penalty shootout.
680	680	3.0	27	Italy won the European Championship for the second time by beating England 3-2 on penalties on Sunday.
681	681	4.0	27	The match finished 1-1 after extra time at Wembley Stadium, which was filled mostly with English fans hoping to celebrate the team's first international trophy since the 1966 World Cup.
682	682	5.0	27	"It's coming to Rome,"" Italy defender Leonardo Bonucci shouted into a TV camera amid the celebrations, mocking the famous lyric ""it's coming home"" from the England team's anthem."
683	683	6.0	27	For England, it was utter dejection again â€” they know the feeling
684	684	7.0	27	so well when it comes to penalties â€” after Gianluigi Donnarumma, Italy's imposing goalkeeper, dived to his left and saved the decisive spot kick by 19-year-old Londoner Bukayo Saka, one of the youngest players in England's squad.
685	685	8.0	27	Bukayo Saka of England misses his team's fifth penalty in a shootout which is saved by Gianluigi Donnarumma of Italy during the UEFA Euro 2020 Championship Final between Italy and England at Wembley Stadium in London on July 11, 2021.
686	686	9.0	27	That was England's third straight failure from the penalty spot in the shootout, with Marcus Rashford and Jadon Sancho â€” players brought on late in extra time seemingly as specialist penalty-takers â€” also missing.
687	687	10.0	27	As Saka and Sancho cried, Donnarumma was mobbed by his teammates as they sprinted toward him from the halfway line at the end of the second penalty shootout in a European Championship final.
688	688	11.0	27	Then Italy's jubilant players headed to the other end of the field and ran as one, diving to the ground in front of the Italian fans who have witnessed a rebirth of their national team.
689	689	12.0	27	It was less than four years ago that Italy plunged to the lowest moment of its soccer history by failing to qualify for the World Cup for the first time in six decades.
690	690	13.0	27	Now, they are the best team in Europe and on a national-record 34-match unbeaten run under Roberto Mancini, their suave coach who has won an international trophy in his first attempt to add to the country's other European title â€” in 1968 â€” and its four World Cups.
691	691	14.0	27	Mancini joined his players on the podium as Italy captain Giorgio Chiellini lifted the Henri Delaunay trophy to the backdrop of fireworks and tickertape.
692	692	15.0	27	"It was impossible even to just consider this at one stage,"" Mancini said, ""but the guys were just amazing."
693	693	16.0	27	For England, it's the latest heartache in shootouts at major tournaments, after defeats in 1990, 1996, 1998, 2004, 2006 and 2012.
694	694	17.0	27	They ended that losing streak by beating Colombia on penalties in the round of 16 at the 2018 World Cup, but the pain has quickly returned.
695	695	18.0	27	"The boys couldn't have given more,"" England captain Harry Kane said."
696	696	19.0	27	Penalties are the worst feeling in the world when you lose.
697	697	20.0	27	It's been a fantastic tournament â€” we should be proud, hold our heads up high.
698	698	21.0	27	"It's going to hurt now, it's going to hurt for a while."""
699	699	22.0	27	Bukayo Saka of England is consoled by teammates Luke Shaw, Kalvin Phillips and Mason Mount following the UEFA Euro 2020 Championship Final between Italy and England at Wembley Stadium on July 11, 2021 in London, England.
700	700	23.0	27	England's first major final in 55 years had all started so well, too, with Luke Shaw scoring the fastest goal in a European Championship final by meeting a cross from opposite wing back
701	701	24.0	27	Kieran Trippier with a half-volley that went in off the post in the second minute.
702	702	25.0	27	It was Shaw's first goal for England and it prompted a fist-pump between David Beckham and Tom Cruise in the VIP box amid an explosion of joy around Wembley, which had at least 67,000 fans inside.
703	703	26.0	27	Maybe more, given dozens of ticketless England fans managed to barge their way past stewards and police and into the stadium in unsettling scenes before kickoff.
704	704	27.0	27	That was the only time Italy's famously robust defense was really opened up in the entire 120 minutes.
705	705	28.0	27	Indeed, after Shaw's goal, England barely saw the ball for the rest of the game.
706	706	29.0	27	Italy's midfielders dominated possession, as widely predicted before the match, and England simply resorted to dropping deep and getting nine or even all 10 outfield players behind the ball.
707	707	30.0	27	It was reminiscent of the 2018 World Cup semifinals, when England also scored early against Croatia then spent most of the game chasing its opponent's midfield before losing in extra time.
708	708	31.0	27	Italy's equalizer was merited and Bonucci was the unlikely scorer.
709	709	32.0	27	He put the ball in from close range after a right-wing corner was flicked on to Marco Verratti, whose stooping header was tipped onto the post by goalkeeper Jordan Pickford.
710	710	33.0	27	England managed to hold on for extra time â€” the way three of the last six European finals went â€” and actually had the better of the final stages.
711	711	34.0	27	After the misses of Rashford â€” he stuttered up to the ball and then hit the post â€” and Sancho, whose shot was saved by Donnarumma again down to his left, Jorginho had the chance to win it for Italy.
712	712	35.0	27	Incredibly, the midfielder who converted the decisive penalty in a shootout win over Spain in the semifinals also failed to score as Pickford tipped the effort off the post.
713	713	36.0	27	It was Donnarumma who then made the crucial saves and within minutes he had also been named player of the tournament, the first goalkeeper to be so honored.
714	714	37.0	27	Italy players celebrate with goalkeeper Gianluigi Donnarumma after he saved the last penalty shoot-out following the UEFA Euro 2020 Final at Wembley Stadium, London.
715	715	38.0	27	So instead of coming home, the trophy is headed to Rome.
716	716	39.0	27	We'd heard it day in, day out from Wednesday night â€”
717	717	40.0	27	"we heard it would be coming home to London,"" Bonucci said."
718	718	41.0	27	I'm sorry for them, but the cup will be taking a nice flight, making its way to Rome
719	719	1.0	28	On a night fraught with tension, Italy clinched its first major title for 15 years with a penalty shootout win over England in the Euro 2020 final.
720	720	2.0	28	Luke Shaw's goal inside the opening two minutes gave England a lead it looked like it would hold onto all night, before a goalmouth scramble midway through the second half allowed Leonardo Bonucci to poke home an equalizer for Italy.
721	721	3.0	28	For the remainder of the match it felt as though extra-time and penalties were inevitable, as neither side seemed willing or brave enough to commit enough men forward to really trouble the opposing defenders.
722	722	4.0	28	England had suffered innumerable heartbreaks on penalties over the years and this time it was Italy's turn to inflict yet more pain on beleaguered English fans as Marcus Rashford, Jadon Sancho and Bukayo Saka all missed from the spot.
723	723	5.0	28	"During the wild Italian celebrations, Bonucci -- who had been immense all night and rightly earned the man of the match award -- screamed ""it's coming to Rome"" into the pitch side camera to rub yet more salt into the wounds of English fans."
724	724	6.0	28	England's wait to end its wretched run in major international competitions, stretching all the way back to 1966, will go for at least another year until the World Cup is hosted in Qatar.
725	725	7.0	28	Few would have expected Italy, which failed to qualify for the 2018 World Cup, to reach the final prior to the start of Euro 2020, much less win the entire competition, but Roberto Mancini's side quickly established itself as one of the contenders after three thrilling group stage performances.
726	726	8.0	28	Gianluigi Donnarumma, Italy's hero in the penalty shootout with two fine saves, was deservedly named the player of the tournament and
727	727	9.0	28	the goalkeeper heads up a group of talented stars that should ensure this side remains competitive for the foreseeable future.
728	728	10.0	28	As for England, this defeat is likely to sting for quite some time to come for players and fans alike, but the squad at least has the consolation of knowing it has provided the country with a tournament run not seen for more than five decades.
729	729	11.0	28	Wembley Way, the famous road leading up to England's national stadium, was heaving as many as seven hours before kick off.
730	730	12.0	28	Many of the fans here in the early afternoon didn't even have tickets, instead choosing to just soak up the atmosphere before moving on to watch the match elsewhere.
731	731	13.0	28	The fridges that stocked beer in one of the grocery stores closest to Wembley Stadium were almost completely empty by late morning.
732	732	14.0	28	For the vast majority of fans in attendance, this was something they had never experienced in their lifetimes.
733	733	15.0	28	It had been 55 long years since England was last in a major international final and fans have known only heartache and disappointment since that World Cup triumph in 1966.
734	734	16.0	28	"One couple considered it such a momentous occasion that they decided to get married on Wembley Way just hours before kick off, both dressed in full wedding attire and holding up England shirts with ""Mr"" and"
735	735	17.0	28	Even when cheering on 'golden generations' of the past, England fans have never supported their national team with a fervor quite like this.
736	736	18.0	28	Southgate and this group of players deserve much of the credit for stirring up such a feeling of national pride.
737	737	19.0	28	Fans provided an electric atmosphere inside Wembley before kick off.
738	738	20.0	28	Stars have regularly used their platform to speak out on social issues and, when it comes to Rashford's fight against child food poverty, have even managed to reverse government policy.
739	739	21.0	28	"I think we've got good players and ice boys, but more importantly relatable boys,"" English journalist Darren Lewis tells CNN."
740	740	22.0	28	I think the secret to the success of this team is that the people in charge of the England team --
741	741	23.0	28	and I mean the PR team around them -- have allowed them to speak on issues that affect them, on issues that people can connect with.
742	742	24.0	28	I remember being at the 2010 World Cup and England were keeping their players away from everyone, treating them like rock stars.
743	743	25.0	28	I remember going down to the harbor in South Africa and the Dutch were walking around -- they were finalists that year -- walking around, talking to people, just enjoying themselves.
744	744	26.0	28	I think this regime who are looking after the team, they realize that it's important just to let the players be players, let them be men who people can connect with.
745	745	27.0	28	If you walk through some parts of the crowd, I remember doing it after games and being struck by the diversity in the crowd; black, brown, white.
746	746	28.0	28	Everyone wants to be a part of this England because they identify with [Raheem] Sterling, [Harry] Kane, [Tyrone] Mings, [Jordan] Henderson.
747	747	29.0	28	They identify with these players because these players aren't detached.
748	748	30.0	28	They care about the people in the places that they come from and that means a lot to the general public.
749	749	31.0	28	However, that feeling of goodwill towards the national team seems to extend no further than England's borders.
750	750	32.0	28	Ahead of the final, viral memes have shown a map of Europe covered in Italian flags to signify the support of every other country on the continent.
751	751	33.0	28	"Much of the animosity towards England and its fans seems to have stemmed from the chant of ""football's coming home,"" the chorus of the 1996 song 'Three Lions' which has become the national team's adopted anthem."
752	752	34.0	28	The song was released ahead of Euro 96, hosted in England, and is about pessimism and despair, but still feeling hope that the national team may finally end years of heartache.
753	753	35.0	28	However, fans of rival countries have interpreted the chant as arrogant and presumptuous, despite multiple attempts to explain its true meaning.
754	754	36.0	28	"It's coming home, it's coming home, it's coming' that's banging [on] since the beginning,"" Italian journalist Tancredi Palmeri told CNN."
755	755	37.0	28	At the beginning it was nice, but then it sounds like: '
756	756	38.0	28	You owe us,' like 'it belongs to us, so you owe us'
757	757	39.0	28	Just look at the footage of people singing all the time 'It's coming home' for a month.
758	758	40.0	28	It doesn't really look like, 'we are being ironic, being sarcastic.'
759	759	41.0	28	It looks like, 'finally we are getting back what is ours.'
760	760	42.0	28	Some fans outside the stadium certainly didn't endear themselves to the watching world when they broke through the security barriers in an attempt to get into Wembley before the gates had been opened.
761	761	43.0	28	In the hour leading up to kick off, Wembley was thundering.
762	762	44.0	28	Large swathes of English and Italian fans were mingling throughout the stadium, joining in chorus to belt out a number of songs that have become English anthems during Euro 2020.
763	763	45.0	28	By the time the national anthems came around, neither of which were booed by opposition fans, Wembley felt as though its very foundations were rocking.
764	764	46.0	28	When Shaw scored, then, with less than two minutes on the clock, the 60,000 or so fans inside the stadium raised the decibels to levels
765	765	47.0	28	Luke Shaw connects with Kieran Trippier's cross to open the scoring.
766	766	48.0	28	It was a wonderful move, too, with Shaw getting on the end of Kieran Trippier's deep cross to the far post to finish off a rapid counterattack.
767	767	49.0	28	England certainly hasn't thrilled with attacking football at this European Championships, instead its success has been built on an organized defense -- the best in the tournament -- and a smothering midfield.
768	768	50.0	28	However, the players perhaps sensed this was an occasion like no other and put Italy on the back foot from the first whistle.
769	769	51.0	28	Throughout Euro 2020, this Italian team has somewhat torn up the defensive blueprints that the country's national team has become synonymous with over the years.
770	770	52.0	28	Though it still boasts tremendous defensive leadership and organization in veteran central pairing Bonucci and Gorgio Chiellini, it's been the more fluid and aggressive attacking style that has caught the eye.
771	771	53.0	28	In the first 25 minutes of this contest, however, they had been stifled entirely by an England team that wasn't affording them a moment's rest on the ball.
772	772	54.0	28	On the rare occasion Italy did enjoy any extended period of possession, boos rang loudly around the stadium and when a foray forward was ended by a wayward pass, England's fans erupted into rapturous cheers.
773	773	55.0	28	Italy was still showing brief flashes of the exciting football that had got it this far -- notably through the quick-footed Lorenzo Insigne -- but its players were quickly met with a solid white wall whenever they threatened to fashion a sight of goal.
774	774	56.0	28	Mancini's side did create one opening before the half was over through Federico Chiesa, the goal hero from Italy's semifinal win over Spain, who picked up the ball from deep and drove towards the box, but could only drag his shot wide of Jordan Pickford's post.
775	775	57.0	28	Before the roar that greeted the referee's half time whistle, for the first time all evening Wembley had quietened down significantly; the first half had gone as perfectly as these fans could have dreamed of, perhaps they were already nervously allowing themselves to believe.
776	776	58.0	28	Italy rallies Less than five minutes into the second half, however, Insigne fired a direct free-kick not too far wide of Pickford's post just as a prompt reminder that this match was far from over.
777	777	59.0	28	With Italy still struggling to create anything from open play, Mancini was forced into making a double substitution after only 50 minutes, bringing on Bryan Cristante and Domenico Berardi for Nicolo Barella the ineffective Ciro Immobile.
778	778	60.0	28	The changes had almost the immediate desired impact, as Italy for the first time got in behind England's back line but Insigne's
779	779	61.0	28	shot from a narrow angle was well blocked by Pickford.
780	780	62.0	28	That chance rallied the Italian fans congregated behind Pickford's goal, who had fallen largely silent after their team's lackluster first half.
781	781	63.0	28	This was now without question Italy's best period of the match so far, for the first time its passing was starting to pull the English defense from one side to another to force some openings.
782	782	64.0	28	England soon retaliated, however, with John Stones rising highest in the area to head Trippier's corner towards goal and force Gianluigi Donnarumma to tip the ball over the crossbar.
783	783	65.0	28	But Italy soon got the goal its improved performance deserved.
784	784	66.0	28	Berardi's corner to the far post somehow found its way to Marco Verratti, who saw his shot saved excellently onto the post by Pickford, but Bonucci was in the right place at the right time to tap the rebound into an empty net.
785	785	67.0	28	Now it was the turn of the Italian fans to fill Wembley with noise, as England's supporters descended into a nervous silence with their team now on the back foot.
786	786	68.0	28	The minor capitulation forced Gareth Southgate into making his first substitutions, as Saka and Henderson replaced Trippier and Declan Rice.
787	787	69.0	28	It so nearly went from bad to worse for England as Bonucci's raking long ball found Berardi bearing down on goal, but the forward could only send his volley over the crossbar.
788	788	70.0	28	England now seemed to be doubting everything that had helped them reach the final; Maguire, normally assured in defense, hacked a desperate clearance away under no pressure at all, while Kane's passes began falling short of their desired target.
789	789	71.0	28	It was almost as if, for the first time all tournament, the magnitude of the occasion had finally started to dawn on these England players.
790	790	72.0	28	The game was on a knife edge as it entered the final 10 minutes, though Italian fans would certainly have been more confident than their English counterparts of snatching a win.
791	791	73.0	28	Extra time continued in much the same vein with neither side able to stamp its authority on proceedings, both perhaps too nervous to commit at this late stage.
792	792	74.0	28	Southgate threw on Rashford, 23, and Sancho, 21, for the penalty shootout but both men went on to miss as England suffered an all too familiar fate.
793	793	1.0	29	LONDON Two soccer-mad nations faced each other, and one blinked.
794	794	2.0	29	Italy bested England in the final of the Euro 2020 soccer tournament Sunday in London.
795	795	3.0	29	The winner was determined by a penalty-kick shootout after extra time that kept the score even at 1.
796	796	4.0	29	Italy won the shootout 3-2 after England's final shot was blocked.
797	797	5.0	29	Italian player Jorge Luiz Frello Filho, known as Jorginho, missed the previous shot, blocked by English goalkeeper Jordan Pickford, sending the London crowd into frenzied cheering, but a first-time European championship for the host country wasn't to be.
798	798	6.0	29	As Covid-19 infection rates continue to rise across the U.K., more than 60,000 fans, most of them English, were allowed to watch the game at Wembley stadium.
799	799	7.0	29	The game started quickly as England's Luke Shaw scored just 2 minutes after kickoff the earliest goal in a European Championship final.
800	800	8.0	29	But Italy came out of halftime aggressive and tied things up when Leonardo Bonucci bundled the ball into England's net after a goal line scramble.
801	801	9.0	29	Players from both teams took a knee before the starting whistle to bring attention to racial injustice, which England players did before every game of the tournament.
802	802	10.0	29	Minutes earlier, dozens of ticketless fans broke into the stadium, with stewards and police trying to hold back the rowdy crowd as they pushed through barriers.
803	803	11.0	29	Prince William, his wife, Kate, and their son Prince George attended the game, the first soccer final played by the England men's team since 1966.
804	804	12.0	29	The tournament ' originally scheduled for last summer ' captivated the U.K. and Italy, which were both hit hard by
805	805	13.0	29	St. George's flags, the national flag of England, flutter at No. 10 Downing Street in central London on Saturday on the eve of the European championship soccer final between England and Italy.
806	806	14.0	29	The U.K.'s four nations, England, Scotland, Wales and Northern Ireland, have the highest Covid-19 death toll in Europe, followed by Italy, according to Johns Hopkins University.
807	807	15.0	29	Although more than half of the British population has been fully vaccinated against Covid-19, the highly transmissible delta variant has led to a surge in cases in recent weeks.
808	808	16.0	29	Italy has been celebrating a dual sporting success as Matteo Berrettini became the first Italian tennis player 'man or woman' to appear in the Wimbledon singles tennis final, which he lost to Novak Djokovic of Serbia.
809	809	17.0	29	Across the U.K., millions tuned in for the game on both the BBC and its commercial rival ITV, which attracted more than 26 million viewers for England's semifinal against Denmark on Wednesday.
810	810	18.0	29	Around the same number of people in the U.K. watched William and Kate get married in 2011.
811	811	19.0	29	Thousands of schoolchildren were given permission to go in late on Monday so they could enjoy the game with their parents.
812	812	20.0	29	There had also been calls for a public holiday if England won.
813	813	21.0	29	Download the NBC News app for breaking news and politics Goodwill toward the team in England was largely unanimous, a change from the start of the tournament, when some fans booed a decision by England's players to take the knee.
814	814	22.0	29	"More than half of the England squad have at least one parent or grandparent born outside the U.K.,"" according to the Migration Museum in central London."
815	815	23.0	29	The squabble over the team's decision was fueled in part by the reaction of Prime Minister Boris Johnson, who did not explicitly condemn the booing.
816	816	24.0	29	"Before the tournament kicked off last month, his spokesman said that when it came to taking a knee, he believed ""in taking action rather than just making gestures."
817	817	25.0	29	Johnson, who has since been pictured in an England jersey, wished the team good luck.
818	818	26.0	29	Several other members of his Conservative Party expressed their support, having previously criticized the team for taking the knee.
819	819	27.0	29	We're all hoping you can go one better and bring it home tonight
820	820	28.0	29	pic.twitter.com/9As9opK5j9 Boris Johnson ( July 11, 2021 England's captain, Harry Kane, was also praised for wearing a rainbow arm band in solidarity with the German team, which stood up for LGBTQ rights when it played Hungary earlier in the tournament.
821	821	29.0	29	Hungary had faced international criticism for a law that bans the promotion of homosexuality or transgender issues in schools, seemingly conflating them with pedophilia.
822	822	30.0	29	When England's men's team last won a major international soccer tournament, the World Cup, more than half a century ago in 1966, it beat what was then West Germany at Wembley Stadium.
823	823	31.0	29	Queen Elizabeth II, who presented the trophy that year, recalled that moment Saturday in a message to England's manager, Gareth Southgate.
824	824	32.0	29	"In a message to the team, she said she hoped ""that history will record not only your success but also the spirit, commitment and pride with which you have conducted yourselves."
825	825	1.0	30	Italy defeats England in UEFA Euro 2020 final in penalty kick shootout LONDON (AP) - Italian soccer's redemption story is complete.
826	826	2.0	30	England's painful half-century wait for a major title goes on.
827	827	3.0	30	And it just had to be because of a penalty shootout.
828	828	4.0	30	Italy won the European Championship for the second time by beating England 3-2 on penalties on Sunday.
829	829	5.0	30	The match finished 1-1 after extra time at Wembley Stadium, which was filled mostly with English fans hoping to celebrate the team's first international trophy since the 1966 World Cup.
830	830	6.0	30	It's coming to Rome, Italy defender Leonardo Bonucci shouted into a TV camera amid the celebrations, mocking the famous lyric it's coming home from the England team's anthem.
831	831	7.0	30	For England, it was utter dejection again - they know the feeling so well
